{"$schema":"https://json-schema.org/draft/2020-12/schema","title":"SectorState","type":"object","required":["schema_version","build_id","dataset","trade_date","session_phase","as_of","known_at","generated_at","freshness","complete","source_status","sector_id","primary_group","classification_confidence","member_count","breadth_pct","sector_score_close","sector_score_intraday"],"properties":{"schema_version":{"const":"2.0.0"},"build_id":{"type":"string"},"dataset":{"const":"sector"},"trade_date":{"type":["string","null"],"format":"date"},"session_phase":{"enum":["PRE_OPEN","LIVE","CLOSE_FREEZE","POST_CLOSE","NEXT_DAY"]},"as_of":{"type":["string","null"],"format":"date-time"},"known_at":{"type":["string","null"],"format":"date-time"},"generated_at":{"type":"string","format":"date-time"},"freshness":{"enum":["LIVE","FRESH","FROZEN","STALE","UNKNOWN"]},"complete":{"type":"boolean"},"source_status":{"type":"object","required":["sources","fallback"],"properties":{"sources":{"type":"array","items":{"type":"string"}},"fallback":{"type":"boolean"},"fallback_source":{"type":["string","null"]},"fallback_build_id":{"type":["string","null"]},"fallback_reason":{"type":["string","null"]},"last_success_at":{"type":["string","null"],"format":"date-time"}},"additionalProperties":false},"sector_id":{"type":"string"},"primary_group":{"type":"string"},"industry_parent":{"type":["string","null"]},"supply_chain_links":{"type":"array","items":{"type":"string"}},"classification_confidence":{"type":["number","null"],"minimum":0,"maximum":100},"taxonomy_version":{"type":"string"},"reviewed_at":{"type":["string","null"],"format":"date-time"},"member_count":{"type":"integer","minimum":0},"advancers":{"type":["integer","null"],"minimum":0},"strong_count":{"type":["integer","null"],"minimum":0},"breadth_pct":{"type":["number","null"],"minimum":0,"maximum":100},"turnover_share":{"type":["number","null"]},"turnover_acceleration":{"type":["number","null"]},"heat_score":{"type":["number","null"]},"heat_delta":{"type":["number","null"]},"momentum_regime":{"type":["string","null"]},"leaders":{"type":"array","items":{"type":"string"}},"leader_count":{"type":["integer","null"],"minimum":0},"persistence":{"type":["number","null"]},"continuation_ratio":{"type":["number","null"]},"sector_score_close":{"type":["number","null"],"minimum":0,"maximum":15},"sector_score_intraday":{"type":["number","null"],"minimum":0,"maximum":20}},"additionalProperties":false}