[{"schema_version":"2.0.0","build_id":"cb2-legacy-20261002-68f1879571","dataset":"sector","trade_date":"2026-10-02","session_phase":"LIVE","as_of":"2026-10-02T13:30:00+08:00","known_at":"2026-10-02T13:30:00+08:00","generated_at":"2026-10-02T11:46:09+08:00","freshness":"LIVE","complete":true,"source_status":{"sources":["docs/data/intraday.json","legacy-v1-migration-adapter"],"fallback":false,"fallback_source":null,"fallback_build_id":null,"fallback_reason":null,"last_success_at":"2026-10-02T13:30:00+08:00"},"sector_id":"LEGACY_0014","primary_group":"CPO／光通訊","industry_parent":null,"supply_chain_links":[],"classification_confidence":60,"taxonomy_version":"legacy-adapter-1","reviewed_at":null,"member_count":6,"advancers":5,"strong_count":1,"breadth_pct":83.3,"turnover_share":null,"turnover_acceleration":null,"heat_score":11.4,"heat_delta":null,"momentum_regime":null,"leaders":["3163","3363","3081","4979","6442"],"leader_count":5,"persistence":null,"continuation_ratio":null,"sector_score_close":5.7,"sector_score_intraday":11.4},{"schema_version":"2.0.0","build_id":"cb2-legacy-20261002-68f1879571","dataset":"sector","trade_date":"2026-10-02","session_phase":"LIVE","as_of":"2026-10-02T13:30:00+08:00","known_at":"2026-10-02T13:30:00+08:00","generated_at":"2026-10-02T11:46:09+08:00","freshness":"LIVE","complete":true,"source_status":{"sources":["docs/data/intraday.json","legacy-v1-migration-adapter"],"fallback":false,"fallback_source":null,"fallback_build_id":null,"fallback_reason":null,"last_success_at":"2026-10-02T13:30:00+08:00"},"sector_id":"LEGACY_0015","primary_group":"高速連接／線材","industry_parent":null,"supply_chain_links":[],"classification_confidence":60,"taxonomy_version":"legacy-adapter-1","reviewed_at":null,"member_count":4,"advancers":2,"strong_count":1,"breadth_pct":50.0,"turnover_share":null,"turnover_acceleration":null,"heat_score":9.4,"heat_delta":null,"momentum_regime":null,"leaders":["3665","6197","3533","3023"],"leader_count":4,"persistence":null,"continuation_ratio":null,"sector_score_close":4.7,"sector_score_intraday":9.4},{"schema_version":"2.0.0","build_id":"cb2-legacy-20261002-68f1879571","dataset":"sector","trade_date":"2026-10-02","session_phase":"LIVE","as_of":"2026-10-02T13:30:00+08:00","known_at":"2026-10-02T13:30:00+08:00","generated_at":"2026-10-02T11:46:09+08:00","freshness":"LIVE","complete":true,"source_status":{"sources":["docs/data/intraday.json","legacy-v1-migration-adapter"],"fallback":false,"fallback_source":null,"fallback_build_id":null,"fallback_reason":null,"last_success_at":"2026-10-02T13:30:00+08:00"},"sector_id":"LEGACY_0017","primary_group":"半導體測試介面","industry_parent":null,"supply_chain_links":[],"classification_confidence":60,"taxonomy_version":"legacy-adapter-1","reviewed_at":null,"member_count":4,"advancers":2,"strong_count":0,"breadth_pct":50.0,"turnover_share":null,"turnover_acceleration":null,"heat_score":8.4,"heat_delta":null,"momentum_regime":null,"leaders":["6223","6515","6510","6683"],"leader_count":4,"persistence":null,"continuation_ratio":null,"sector_score_close":4.2,"sector_score_intraday":8.4},{"schema_version":"2.0.0","build_id":"cb2-legacy-20261002-68f1879571","dataset":"sector","trade_date":"2026-10-02","session_phase":"LIVE","as_of":"2026-10-02T13:30:00+08:00","known_at":"2026-10-02T13:30:00+08:00","generated_at":"2026-10-02T11:46:09+08:00","freshness":"LIVE","complete":true,"source_status":{"sources":["docs/data/intraday.json","legacy-v1-migration-adapter"],"fallback":false,"fallback_source":null,"fallback_build_id":null,"fallback_reason":null,"last_success_at":"2026-10-02T13:30:00+08:00"},"sector_id":"LEGACY_0001","primary_group":"生技醫療","industry_parent":null,"supply_chain_links":[],"classification_confidence":60,"taxonomy_version":"legacy-adapter-1","reviewed_at":null,"member_count":26,"advancers":17,"strong_count":2,"breadth_pct":65.4,"turnover_share":null,"turnover_acceleration":null,"heat_score":8.0,"heat_delta":null,"momentum_regime":null,"leaders":["6535","6885","6491","3176","4746"],"leader_count":5,"persistence":null,"continuation_ratio":null,"sector_score_close":4.0,"sector_score_intraday":8.0},{"schema_version":"2.0.0","build_id":"cb2-legacy-20261002-68f1879571","dataset":"sector","trade_date":"2026-10-02","session_phase":"LIVE","as_of":"2026-10-02T13:30:00+08:00","known_at":"2026-10-02T13:30:00+08:00","generated_at":"2026-10-02T11:46:09+08:00","freshness":"LIVE","complete":true,"source_status":{"sources":["docs/data/intraday.json","legacy-v1-migration-adapter"],"fallback":false,"fallback_source":null,"fallback_build_id":null,"fallback_reason":null,"last_success_at":"2026-10-02T13:30:00+08:00"},"sector_id":"LEGACY_0022","primary_group":"ABF載板","industry_parent":null,"supply_chain_links":[],"classification_confidence":60,"taxonomy_version":"legacy-adapter-1","reviewed_at":null,"member_count":3,"advancers":2,"strong_count":0,"breadth_pct":66.7,"turnover_share":null,"turnover_acceleration":null,"heat_score":8.0,"heat_delta":null,"momentum_regime":null,"leaders":["8046","3037","3189"],"leader_count":3,"persistence":null,"continuation_ratio":null,"sector_score_close":4.0,"sector_score_intraday":8.0},{"schema_version":"2.0.0","build_id":"cb2-legacy-20261002-68f1879571","dataset":"sector","trade_date":"2026-10-02","session_phase":"LIVE","as_of":"2026-10-02T13:30:00+08:00","known_at":"2026-10-02T13:30:00+08:00","generated_at":"2026-10-02T11:46:09+08:00","freshness":"LIVE","complete":true,"source_status":{"sources":["docs/data/intraday.json","legacy-v1-migration-adapter"],"fallback":false,"fallback_source":null,"fallback_build_id":null,"fallback_reason":null,"last_success_at":"2026-10-02T13:30:00+08:00"},"sector_id":"LEGACY_0023","primary_group":"CCL／銅箔","industry_parent":null,"supply_chain_links":[],"classification_confidence":60,"taxonomy_version":"legacy-adapter-1","reviewed_at":null,"member_count":4,"advancers":4,"strong_count":0,"breadth_pct":100.0,"turnover_share":null,"turnover_acceleration":null,"heat_score":8.0,"heat_delta":null,"momentum_regime":null,"leaders":["2383","8358","6213","6274"],"leader_count":4,"persistence":null,"continuation_ratio":null,"sector_score_close":4.0,"sector_score_intraday":8.0},{"schema_version":"2.0.0","build_id":"cb2-legacy-20261002-68f1879571","dataset":"sector","trade_date":"2026-10-02","session_phase":"LIVE","as_of":"2026-10-02T13:30:00+08:00","known_at":"2026-10-02T13:30:00+08:00","generated_at":"2026-10-02T11:46:09+08:00","freshness":"LIVE","complete":true,"source_status":{"sources":["docs/data/intraday.json","legacy-v1-migration-adapter"],"fallback":false,"fallback_source":null,"fallback_build_id":null,"fallback_reason":null,"last_success_at":"2026-10-02T13:30:00+08:00"},"sector_id":"LEGACY_0018","primary_group":"網通IC","industry_parent":null,"supply_chain_links":[],"classification_confidence":60,"taxonomy_version":"legacy-adapter-1","reviewed_at":null,"member_count":1,"advancers":1,"strong_count":0,"breadth_pct":100.0,"turnover_share":null,"turnover_acceleration":null,"heat_score":7.0,"heat_delta":null,"momentum_regime":null,"leaders":["8040"],"leader_count":1,"persistence":null,"continuation_ratio":null,"sector_score_close":3.5,"sector_score_intraday":7.0},{"schema_version":"2.0.0","build_id":"cb2-legacy-20261002-68f1879571","dataset":"sector","trade_date":"2026-10-02","session_phase":"LIVE","as_of":"2026-10-02T13:30:00+08:00","known_at":"2026-10-02T13:30:00+08:00","generated_at":"2026-10-02T11:46:09+08:00","freshness":"LIVE","complete":true,"source_status":{"sources":["docs/data/intraday.json","legacy-v1-migration-adapter"],"fallback":false,"fallback_source":null,"fallback_build_id":null,"fallback_reason":null,"last_success_at":"2026-10-02T13:30:00+08:00"},"sector_id":"LEGACY_0032","primary_group":"ASIC／IC設計服務","industry_parent":null,"supply_chain_links":[],"classification_confidence":60,"taxonomy_version":"legacy-adapter-1","reviewed_at":null,"member_count":3,"advancers":3,"strong_count":0,"breadth_pct":100.0,"turnover_share":null,"turnover_acceleration":null,"heat_score":7.0,"heat_delta":null,"momentum_regime":null,"leaders":["3661","3035","3443"],"leader_count":3,"persistence":null,"continuation_ratio":null,"sector_score_close":3.5,"sector_score_intraday":7.0},{"schema_version":"2.0.0","build_id":"cb2-legacy-20261002-68f1879571","dataset":"sector","trade_date":"2026-10-02","session_phase":"LIVE","as_of":"2026-10-02T13:30:00+08:00","known_at":"2026-10-02T13:30:00+08:00","generated_at":"2026-10-02T11:46:09+08:00","freshness":"LIVE","complete":true,"source_status":{"sources":["docs/data/intraday.json","legacy-v1-migration-adapter"],"fallback":false,"fallback_source":null,"fallback_build_id":null,"fallback_reason":null,"last_success_at":"2026-10-02T13:30:00+08:00"},"sector_id":"LEGACY_0052","primary_group":"矽晶圓","industry_parent":null,"supply_chain_links":[],"classification_confidence":60,"taxonomy_version":"legacy-adapter-1","reviewed_at":null,"member_count":4,"advancers":4,"strong_count":0,"breadth_pct":100.0,"turnover_share":null,"turnover_acceleration":null,"heat_score":7.0,"heat_delta":null,"momentum_regime":null,"leaders":["6182","5483","3532","6488"],"leader_count":4,"persistence":null,"continuation_ratio":null,"sector_score_close":3.5,"sector_score_intraday":7.0},{"schema_version":"2.0.0","build_id":"cb2-legacy-20261002-68f1879571","dataset":"sector","trade_date":"2026-10-02","session_phase":"LIVE","as_of":"2026-10-02T13:30:00+08:00","known_at":"2026-10-02T13:30:00+08:00","generated_at":"2026-10-02T11:46:09+08:00","freshness":"LIVE","complete":true,"source_status":{"sources":["docs/data/intraday.json","legacy-v1-migration-adapter"],"fallback":false,"fallback_source":null,"fallback_build_id":null,"fallback_reason":null,"last_success_at":"2026-10-02T13:30:00+08:00"},"sector_id":"LEGACY_0026","primary_group":"PCB／多層板","industry_parent":null,"supply_chain_links":[],"classification_confidence":60,"taxonomy_version":"legacy-adapter-1","reviewed_at":null,"member_count":9,"advancers":7,"strong_count":0,"brea